DEF CON Radio (Mid-tempo Downtempo Chill Ambient | SomaFM),http://ice2.somafm.com/defcon-128-aac
Drone Zone (Ambient Space | SomaFM),http://ice1.somafm.com/dronezone-256-mp3
Deep Space One (Ambient Space | SomaFM),https://somafm.com/deepspaceone130.pls
SF 10-33 (Ambient | Police Dispatch | SomaFM),http://somafm.com/sf1033130.pls
Mission Control (Ambient | space flight chatter | SomaFM),https://somafm.com/missioncontrol130.pls
Space Station Soma (Downtempo | SomaFM),http://ice3.somafm.com/spacestation-128-mp3
Doomed (Ambient Industrial | SomaFM),http://somafm.com/specials130.pls
Echoes of Bluemars (Ambient),http://streams.echoesofbluemars.org:8000/bluemars
Cryosleep (Ambient),http://streams.echoesofbluemars.org:8000/cryosleep
Dark Ambient Radio (Germany),http://s3.viastreaming.net:8835/
Verdure (Russia | deep ambient | idm),http://air.verdure.net:8881/stream
Groove Salad (Ambient Downtempo | SomaFM),http://ice1.somafm.com/groovesalad-256-mp3
Groove Salad Classic (Downtempo Chillout | SomaFM),https://somafm.com/gsclassic130.pls
Systrum Sistum - SSR1 (Drone Ambient | Australia),http://systrum.net:8000/Systrum-Channel1.m3u
STR | Space Travel Radio (Lounge Ambient Space | Germany),http://136.243.156.30:1701/stream/2/
Sleep Radio Stream (Ambient | New Zealand),http://149.56.234.138:8169/stream
Seven Rays | 7rays (New Age Chillout Ambient | Ukraine),http://7rays.stream.laut.fm/7rays
Radio Record (Chill Ambient | Russia),http://air.radiorecord.ru:8102/chil_320
Radio Provodakh | "Wires" (Chillout Ambient | Russia),http://station.waveradio.org/provodach
Chillout Zone (Drone Ambient Downtempo Lounge Chillout),http://5.189.142.165:2304/stream
Radio Dimensione Relax (Chillout Lounge Ambient | Italy),http://tachyon.shoutca.st:8919/stream
Radio Caprice (Drone Ambient | Russia),http://79.111.119.111:8002/droneambient
Planet Ambi (Ambient | Swiss),http://philae.shoutca.st:9019/stream
Pink Noise Radio (Chillout Ambient Noise | UK),http://uk1.internet-radio.com:8004/stream
MixLive.ie | Psybient Sunset (Chillout Psybient Ambient Chillout Psychedelic Psy | Ireland),http://198.24.145.146:9318/stream
MixLive.ie (Ambient | Ireland),http://mixlive.ie:9332/;ambient
MaschinenGeist (Ambient Drone Experimental Downtempo Space DreamPop | Zürich),http://i.20hz.biz:8000/maschinengeist.org.192.mp3
Life Chill Music (Chill Chillout Downtempo Ambient Loungeq),http://aska.ru-hoster.com:8053/autodj
HEXX 9 Radio (Ambient Electronic Experimental Goth | New York),http://46.105.124.120:8604/stream
HBR1 | Dream Factory (Ambient Chillout Downbeat Trance | Germany),http://radio.hbr1.com:19800/ambient.ogg
Ghost Box (Dark Ambient Downtempo Tribal Industrial Goth Pagan),http://108.61.154.147:5940
Dream Factory (Ambient Chill | Germany),http://ubuntu.hbr1.com:19800/ambient.ogg
Ambient Sleeping Pill (Ambient Freestyle Experimental | Ohio),http://radio.stereoscenic.com/asp-s
Ambient Sleeping Pill (Meditation Sleep Ambient | Ohio),http://radio.stereoscenic.com/asp-h
Ambient Modern (Chillout Ambient | Ohio),http://radio.stereoscenic.com/mod-h
